{
  "schema_version": 4,
  "agent_version": "0.3.8",
  "executor_version": "0.3.8",
  "runner_protocol": 1,
  "executor_protocol": 4,
  "protocol": { "minimum": 11, "maximum": 16 },
  "systemd_units": {
    "agent": { "url": "https://release.example.test/deploy-go-agent.service", "sha256": "aaaaaaaaaaaaaaaaaaaaaaaaaaaaaaaaaaaaaaaaaaaaaaaaaaaaaaaaaaaaaaaa" },
    "runner": { "url": "https://release.example.test/deploy-go-agent-runner.service", "sha256": "bbbbbbbbbbbbbbbbbbbbbbbbbbbbbbbbbbbbbbbbbbbbbbbbbbbbbbbbbbbbbbbb" },
    "executor": { "url": "https://release.example.test/deploy-go-agent-executor.service", "sha256": "cccccccccccccccccccccccccccccccccccccccccccccccccccccccccccccccc" },
    "updater": { "url": "https://release.example.test/deploy-go-agent-updater.service", "sha256": "dddddddddddddddddddddddddddddddddddddddddddddddddddddddddddddddd" }
  },
  "executor_config": { "url": "https://release.example.test/executor.json.in", "sha256": "eeeeeeeeeeeeeeeeeeeeeeeeeeeeeeeeeeeeeeeeeeeeeeeeeeeeeeeeeeeeeeee" },
  "artifacts": [
    { "component": "agent", "os": "linux", "architecture": "x86_64", "url": "https://release.example.test/deploy-go-agent-linux-x86_64", "sha256": "1111111111111111111111111111111111111111111111111111111111111111" },
    { "component": "executor", "os": "linux", "architecture": "x86_64", "url": "https://release.example.test/deploy-go-agent-executor-linux-x86_64", "sha256": "2222222222222222222222222222222222222222222222222222222222222222" },
    { "component": "updater", "os": "linux", "architecture": "x86_64", "url": "https://release.example.test/deploy-go-agent-updater-linux-x86_64", "sha256": "3333333333333333333333333333333333333333333333333333333333333333" }
  ]
}
